{
  "schemaVersion": "obiara.provider-diligence.v1",
  "generatedAt": "2026-07-27T11:00:00Z",
  "expiresAt": "2026-07-27T13:00:00Z",
  "environment": "production",
  "market": "GH",
  "providers": [
    {
      "id": "atlas", "outcome": "pending", "synthetic": true,
      "issuerRef": "role/procurement-owner", "reviewerRef": "role/privacy-reviewer",
      "evidence": [
        {"subject":"dpa","evidenceRef":"0000000000000000000000000000000000000000000000000000000000000001","collectedAt":"2026-07-27T11:00:00Z","expiresAt":"2026-07-28T11:00:00Z","outcome":"pending","synthetic":true},
        {"subject":"subprocessors","evidenceRef":"0000000000000000000000000000000000000000000000000000000000000002","collectedAt":"2026-07-27T11:00:00Z","expiresAt":"2026-07-28T11:00:00Z","outcome":"pending","synthetic":true},
        {"subject":"locations","evidenceRef":"0000000000000000000000000000000000000000000000000000000000000003","collectedAt":"2026-07-27T11:00:00Z","expiresAt":"2026-07-28T11:00:00Z","outcome":"pending","synthetic":true},
        {"subject":"retention","evidenceRef":"0000000000000000000000000000000000000000000000000000000000000004","collectedAt":"2026-07-27T11:00:00Z","expiresAt":"2026-07-28T11:00:00Z","outcome":"pending","synthetic":true},
        {"subject":"deletion","evidenceRef":"0000000000000000000000000000000000000000000000000000000000000005","collectedAt":"2026-07-27T11:00:00Z","expiresAt":"2026-07-28T11:00:00Z","outcome":"pending","synthetic":true},
        {"subject":"keys","evidenceRef":"0000000000000000000000000000000000000000000000000000000000000006","collectedAt":"2026-07-27T11:00:00Z","expiresAt":"2026-07-28T11:00:00Z","outcome":"pending","synthetic":true},
        {"subject":"support","evidenceRef":"0000000000000000000000000000000000000000000000000000000000000007","collectedAt":"2026-07-27T11:00:00Z","expiresAt":"2026-07-28T11:00:00Z","outcome":"pending","synthetic":true},
        {"subject":"breach","evidenceRef":"0000000000000000000000000000000000000000000000000000000000000008","collectedAt":"2026-07-27T11:00:00Z","expiresAt":"2026-07-28T11:00:00Z","outcome":"pending","synthetic":true},
        {"subject":"cost","evidenceRef":"0000000000000000000000000000000000000000000000000000000000000009","collectedAt":"2026-07-27T11:00:00Z","expiresAt":"2026-07-28T11:00:00Z","outcome":"pending","synthetic":true},
        {"subject":"exit","evidenceRef":"000000000000000000000000000000000000000000000000000000000000000a","collectedAt":"2026-07-27T11:00:00Z","expiresAt":"2026-07-28T11:00:00Z","outcome":"pending","synthetic":true}
      ]
    },
    {
      "id": "storage-cdn", "outcome": "pending", "synthetic": true,
      "issuerRef": "role/procurement-owner", "reviewerRef": "role/security-reviewer",
      "evidence": [
        {"subject":"dpa","evidenceRef":"000000000000000000000000000000000000000000000000000000000000000b","collectedAt":"2026-07-27T11:00:00Z","expiresAt":"2026-07-28T11:00:00Z","outcome":"pending","synthetic":true},
        {"subject":"subprocessors","evidenceRef":"000000000000000000000000000000000000000000000000000000000000000c","collectedAt":"2026-07-27T11:00:00Z","expiresAt":"2026-07-28T11:00:00Z","outcome":"pending","synthetic":true},
        {"subject":"locations","evidenceRef":"000000000000000000000000000000000000000000000000000000000000000d","collectedAt":"2026-07-27T11:00:00Z","expiresAt":"2026-07-28T11:00:00Z","outcome":"pending","synthetic":true},
        {"subject":"retention","evidenceRef":"000000000000000000000000000000000000000000000000000000000000000e","collectedAt":"2026-07-27T11:00:00Z","expiresAt":"2026-07-28T11:00:00Z","outcome":"pending","synthetic":true},
        {"subject":"deletion","evidenceRef":"000000000000000000000000000000000000000000000000000000000000000f","collectedAt":"2026-07-27T11:00:00Z","expiresAt":"2026-07-28T11:00:00Z","outcome":"pending","synthetic":true},
        {"subject":"keys","evidenceRef":"0000000000000000000000000000000000000000000000000000000000000010","collectedAt":"2026-07-27T11:00:00Z","expiresAt":"2026-07-28T11:00:00Z","outcome":"pending","synthetic":true},
        {"subject":"support","evidenceRef":"0000000000000000000000000000000000000000000000000000000000000011","collectedAt":"2026-07-27T11:00:00Z","expiresAt":"2026-07-28T11:00:00Z","outcome":"pending","synthetic":true},
        {"subject":"breach","evidenceRef":"0000000000000000000000000000000000000000000000000000000000000012","collectedAt":"2026-07-27T11:00:00Z","expiresAt":"2026-07-28T11:00:00Z","outcome":"pending","synthetic":true},
        {"subject":"cost","evidenceRef":"0000000000000000000000000000000000000000000000000000000000000013","collectedAt":"2026-07-27T11:00:00Z","expiresAt":"2026-07-28T11:00:00Z","outcome":"pending","synthetic":true},
        {"subject":"exit","evidenceRef":"0000000000000000000000000000000000000000000000000000000000000014","collectedAt":"2026-07-27T11:00:00Z","expiresAt":"2026-07-28T11:00:00Z","outcome":"pending","synthetic":true}
      ]
    },
    {
      "id": "livekit", "outcome": "pending", "synthetic": true,
      "issuerRef": "role/realtime-owner", "reviewerRef": "role/privacy-reviewer",
      "evidence": [
        {"subject":"dpa","evidenceRef":"0000000000000000000000000000000000000000000000000000000000000015","collectedAt":"2026-07-27T11:00:00Z","expiresAt":"2026-07-28T11:00:00Z","outcome":"pending","synthetic":true},
        {"subject":"subprocessors","evidenceRef":"0000000000000000000000000000000000000000000000000000000000000016","collectedAt":"2026-07-27T11:00:00Z","expiresAt":"2026-07-28T11:00:00Z","outcome":"pending","synthetic":true},
        {"subject":"locations","evidenceRef":"0000000000000000000000000000000000000000000000000000000000000017","collectedAt":"2026-07-27T11:00:00Z","expiresAt":"2026-07-28T11:00:00Z","outcome":"pending","synthetic":true},
        {"subject":"retention","evidenceRef":"0000000000000000000000000000000000000000000000000000000000000018","collectedAt":"2026-07-27T11:00:00Z","expiresAt":"2026-07-28T11:00:00Z","outcome":"pending","synthetic":true},
        {"subject":"deletion","evidenceRef":"0000000000000000000000000000000000000000000000000000000000000019","collectedAt":"2026-07-27T11:00:00Z","expiresAt":"2026-07-28T11:00:00Z","outcome":"pending","synthetic":true},
        {"subject":"keys","evidenceRef":"000000000000000000000000000000000000000000000000000000000000001a","collectedAt":"2026-07-27T11:00:00Z","expiresAt":"2026-07-28T11:00:00Z","outcome":"pending","synthetic":true},
        {"subject":"support","evidenceRef":"000000000000000000000000000000000000000000000000000000000000001b","collectedAt":"2026-07-27T11:00:00Z","expiresAt":"2026-07-28T11:00:00Z","outcome":"pending","synthetic":true},
        {"subject":"breach","evidenceRef":"000000000000000000000000000000000000000000000000000000000000001c","collectedAt":"2026-07-27T11:00:00Z","expiresAt":"2026-07-28T11:00:00Z","outcome":"pending","synthetic":true},
        {"subject":"cost","evidenceRef":"000000000000000000000000000000000000000000000000000000000000001d","collectedAt":"2026-07-27T11:00:00Z","expiresAt":"2026-07-28T11:00:00Z","outcome":"pending","synthetic":true},
        {"subject":"exit","evidenceRef":"000000000000000000000000000000000000000000000000000000000000001e","collectedAt":"2026-07-27T11:00:00Z","expiresAt":"2026-07-28T11:00:00Z","outcome":"pending","synthetic":true}
      ]
    },
    {
      "id": "communications", "outcome": "pending", "synthetic": true,
      "issuerRef": "role/communications-owner", "reviewerRef": "role/privacy-reviewer",
      "evidence": [
        {"subject":"dpa","evidenceRef":"000000000000000000000000000000000000000000000000000000000000001f","collectedAt":"2026-07-27T11:00:00Z","expiresAt":"2026-07-28T11:00:00Z","outcome":"pending","synthetic":true},
        {"subject":"subprocessors","evidenceRef":"0000000000000000000000000000000000000000000000000000000000000020","collectedAt":"2026-07-27T11:00:00Z","expiresAt":"2026-07-28T11:00:00Z","outcome":"pending","synthetic":true},
        {"subject":"locations","evidenceRef":"0000000000000000000000000000000000000000000000000000000000000021","collectedAt":"2026-07-27T11:00:00Z","expiresAt":"2026-07-28T11:00:00Z","outcome":"pending","synthetic":true},
        {"subject":"retention","evidenceRef":"0000000000000000000000000000000000000000000000000000000000000022","collectedAt":"2026-07-27T11:00:00Z","expiresAt":"2026-07-28T11:00:00Z","outcome":"pending","synthetic":true},
        {"subject":"deletion","evidenceRef":"0000000000000000000000000000000000000000000000000000000000000023","collectedAt":"2026-07-27T11:00:00Z","expiresAt":"2026-07-28T11:00:00Z","outcome":"pending","synthetic":true},
        {"subject":"keys","evidenceRef":"0000000000000000000000000000000000000000000000000000000000000024","collectedAt":"2026-07-27T11:00:00Z","expiresAt":"2026-07-28T11:00:00Z","outcome":"pending","synthetic":true},
        {"subject":"support","evidenceRef":"0000000000000000000000000000000000000000000000000000000000000025","collectedAt":"2026-07-27T11:00:00Z","expiresAt":"2026-07-28T11:00:00Z","outcome":"pending","synthetic":true},
        {"subject":"breach","evidenceRef":"0000000000000000000000000000000000000000000000000000000000000026","collectedAt":"2026-07-27T11:00:00Z","expiresAt":"2026-07-28T11:00:00Z","outcome":"pending","synthetic":true},
        {"subject":"cost","evidenceRef":"0000000000000000000000000000000000000000000000000000000000000027","collectedAt":"2026-07-27T11:00:00Z","expiresAt":"2026-07-28T11:00:00Z","outcome":"pending","synthetic":true},
        {"subject":"exit","evidenceRef":"0000000000000000000000000000000000000000000000000000000000000028","collectedAt":"2026-07-27T11:00:00Z","expiresAt":"2026-07-28T11:00:00Z","outcome":"pending","synthetic":true}
      ]
    }
  ]
}
